{
  "schema_version": "1.1",
  "lexicon_id": "konstellation-explorer-fr-1",
  "entries": [
    {
      "semantic_ref": "konstellation:selection-type",
      "language": "fr",
      "lexical_ref": "Type de sélection",
      "binding_kind": "literal"
    },
    {
      "semantic_ref": "konstellation:selection-identities",
      "language": "fr",
      "lexical_ref": "Identités sélectionnées",
      "binding_kind": "literal"
    },
    {
      "semantic_ref": "konstellation:selection-link",
      "language": "fr",
      "lexical_ref": "Lien de sélection",
      "binding_kind": "literal"
    },
    {
      "semantic_ref": "konstellation:read-context",
      "language": "fr",
      "lexical_ref": "Contexte de lecture",
      "binding_kind": "literal"
    },
    {
      "semantic_ref": "konstellation:result-page",
      "language": "fr",
      "lexical_ref": "Page de résultats",
      "binding_kind": "literal"
    },
    {
      "semantic_ref": "konstellation:inspected-entity",
      "language": "fr",
      "lexical_ref": "Entité inspectée",
      "binding_kind": "literal"
    },
    {
      "semantic_ref": "konstellation:reported-assertion",
      "language": "fr",
      "lexical_ref": "Assertion rapportée",
      "binding_kind": "literal"
    },
    {
      "semantic_ref": "konstellation:filter-in",
      "language": "fr",
      "lexical_ref": "Correspond à une valeur",
      "binding_kind": "literal"
    },
    {
      "semantic_ref": "konstellation:filter-none_of",
      "language": "fr",
      "lexical_ref": "Exclut ces valeurs",
      "binding_kind": "literal"
    },
    {
      "semantic_ref": "konstellation:filter-exists",
      "language": "fr",
      "lexical_ref": "Relation renseignée",
      "binding_kind": "literal"
    },
    {
      "semantic_ref": "konstellation:filter-missing_in_view",
      "language": "fr",
      "lexical_ref": "Absence dans la vue de lecture",
      "binding_kind": "literal"
    },
    {
      "semantic_ref": "konstellation:filter-overlaps",
      "language": "fr",
      "lexical_ref": "Chevauchement certain de période",
      "binding_kind": "literal"
    },
    {
      "semantic_ref": "konstellation:assertion-status",
      "language": "fr",
      "lexical_ref": "Statut de l’assertion",
      "binding_kind": "literal"
    },
    {
      "semantic_ref": "konstellation:assertion-certainty",
      "language": "fr",
      "lexical_ref": "Certitude",
      "binding_kind": "literal"
    },
    {
      "semantic_ref": "konstellation:assertion-validationStatus",
      "language": "fr",
      "lexical_ref": "Statut de validation",
      "binding_kind": "literal"
    },
    {
      "semantic_ref": "konstellation:assertion-validatedAs",
      "language": "fr",
      "lexical_ref": "Validée comme",
      "binding_kind": "literal"
    },
    {
      "semantic_ref": "konstellation:assertion-authority",
      "language": "fr",
      "lexical_ref": "Autorité",
      "binding_kind": "literal"
    },
    {
      "semantic_ref": "konstellation:assertion-recognitionStatus",
      "language": "fr",
      "lexical_ref": "Reconnaissance",
      "binding_kind": "literal"
    },
    {
      "semantic_ref": "konstellation:assertion-artifactStatus",
      "language": "fr",
      "lexical_ref": "Statut du corpus",
      "binding_kind": "literal"
    },
    {
      "semantic_ref": "konstellation:assertion-scope",
      "language": "fr",
      "lexical_ref": "Portée",
      "binding_kind": "literal"
    },
    {
      "semantic_ref": "konstellation:assertion-qualifiers",
      "language": "fr",
      "lexical_ref": "Qualificatifs",
      "binding_kind": "literal"
    },
    {
      "semantic_ref": "konstellation:assertion-validationPolicyRef",
      "language": "fr",
      "lexical_ref": "Politique de validation",
      "binding_kind": "literal"
    },
    {
      "semantic_ref": "konstellation:assertion-readerLabels",
      "language": "fr",
      "lexical_ref": "Labels de lecture",
      "binding_kind": "literal"
    },
    {
      "semantic_ref": "konstellation:assertion-conflictsWith",
      "language": "fr",
      "lexical_ref": "Divergences",
      "binding_kind": "literal"
    },
    {
      "semantic_ref": "konstellation:assertion-ruleRef",
      "language": "fr",
      "lexical_ref": "Règle de dérivation",
      "binding_kind": "literal"
    }
  ],
  "source_kind": "project",
  "source_ref": "profile:konstellation-explorer-1",
  "lexical_policy": {
    "policy_version": "1.0",
    "precedence": [
      "request_override",
      "domain",
      "project",
      "wikidata",
      "gf_generic"
    ],
    "default_source_kind": "project",
    "equal_precedence_conflict": "fail"
  }
}
